{
  "schema_version": 1,
  "title": "Settings runtime 卡片隐藏低价值描述行",
  "time": "2026-05-27T11:37:02Z",
  "source": "codex",
  "project": "blackboard",
  "topic": "settings runtime panel hides runtime descriptions",
  "done": [
    "在 bb_web/src/components/SettingsWorkbench.vue 移除 runtime 卡片标题下方的描述行，例如 CodeBuddy runtime for codebase work。",
    "删除 SettingsWorkbench 内只为该描述行服务的 runtimeDescription helper 和 RuntimeProfile 类型导入；保留 i18n 描述 key，因为 RuntimeConnectorPanel 仍在使用。"
  ],
  "validation": [
    "npm run build --prefix bb_web: 通过。",
    "Browser in-app page check http://localhost:8060/#/projects/blackboard/settings: 通过；首个 runtime titleText 为 CodeBuddy，titleParagraphCount 为 0，未出现 CodeBuddy runtime for codebase work；版本锁定、安装方式、AGENTS.md/MCP 仍可见。"
  ],
  "next_step": [
    "继续根据用户现场标注隐藏 Settings runtime 面板里低决策价值的信息。"
  ],
  "related_locations": [
    "bb_web/src/components/SettingsWorkbench.vue",
    "bb_web/src/i18n.ts"
  ],
  "related_tickets": [],
  "attachments": [],
  "extra": {}
}
