{
  "schema_version": 1,
  "title": "继续收敛 label/value metadata 到 BbInfoGrid",
  "time": "2026-05-23T00:00:00+08:00",
  "source": "codex",
  "project": "blackboard",
  "topic": "frontend-shared-ui-primitives-ninth-pass",
  "done": [
    "增强 BbInfoGrid / BbInfoItem：支持 cards/rows 布局、metric/mono 变体、truncate/wrap 溢出策略，并通过 CSS variables 控制密度、字体、行布局。",
    "迁移 AgentConnectorPanel 的 registry 统计、AgentConnectorRow 的 target metadata 到 BbInfoGrid/BbInfoItem。",
    "迁移 RuntimeConnectorPanel 的 runtime facts、Pi mini meta、diagnostics rows 到 BbInfoGrid/BbInfoItem。",
    "迁移 TaskGraphPreviewPanel 的 node popover fields、TaskGraphRunPanel 的 run-level state 与 run inputs 到 BbInfoGrid/BbInfoItem。",
    "迁移 InboxStructuredDocument 的 JSON meta/extra 和 TicketStructuredDocument 的 risk meta 到 BbInfoGrid/BbInfoItem。BDD story Given/When/Then 保留领域结构。",
    "更新 DESIGN.md：明确 metadata 用 BbInfoGrid/BbInfoItem，cards 用于 fact cells，rows 用于 diagnostics/popovers/document metadata。"
  ],
  "validation": [
    "rg '<dl|<dt|<dd' bb_web/src/components bb_web/src/views：仅剩 BbInfoGrid/BbInfoItem 本体与 TicketStructuredDocument 的 BDD story lines。",
    "git diff --check -- 本轮相关 bb_web 文件：通过，仅 CRLF warning。",
    "npm run build --prefix bb_web：通过。",
    "Browser smoke：打开 Agents / Inbox / Tickets / Task Graphs 路由，页面均可加载且无 console error；Inbox 实际渲染到 1 个 .bb-info-grid / 5 个 .bb-info-item，其他路由当前未进入被改的细节面板。"
  ],
  "next_step": [
    "下一轮最值得收的是 BbSectionHeader：统一 section 标题、副标题、右侧 actions/count。",
    "再下一层是 BbToolbar：统一页面/面板顶部的刷新、搜索、筛选、新建等操作区。"
  ],
  "related_locations": [
    "bb_web/src/components/common/BbInfoGrid.vue",
    "bb_web/src/components/common/BbInfoItem.vue",
    "bb_web/src/styles.css",
    "bb_web/src/components/AgentConnectorPanel.vue",
    "bb_web/src/components/AgentConnectorRow.vue",
    "bb_web/src/components/RuntimeConnectorPanel.vue",
    "bb_web/src/components/task-graph/TaskGraphPreviewPanel.vue",
    "bb_web/src/components/TaskGraphRunPanel.vue",
    "bb_web/src/components/InboxStructuredDocument.vue",
    "bb_web/src/components/TicketStructuredDocument.vue",
    "bb_web/DESIGN.md"
  ],
  "related_tickets": [],
  "attachments": [],
  "extra": {}
}
