{
  "schema_version": 1,
  "title": "Task Graph 预览面板操作组收敛",
  "time": "2026-05-23T16:46:22Z",
  "source": "codex-gpt-5.5-medium",
  "project": "blackboard",
  "topic": "bb_web UI 收敛 graph 小片试验",
  "done": [
    "将 TaskGraphPreviewPanel 头部预览操作从原生 button + bb-top-action-button 收敛为 BbActionGroup + BbButton。",
    "移除该区域重复的 page-local flex/gap 操作组语法，仅保留 min-width 布局约束。",
    "未新增 shared primitive，未修改后端、桌面端、ticket、wiki、runtime、node_modules 或 dist 源文件。"
  ],
  "validation": [
    "npm run build --prefix C:/Dev/blackboard/bb_web: 通过",
    "mcp__bb__.list_projects: 通过",
    "mcp__bb__.create_inbox_note: 当前调用"
  ],
  "next_step": [
    "由外部验证链路继续做 Windows Browser Use 冒烟，检查 Task Graph 预览头部按钮视觉和点击行为。"
  ],
  "related_locations": [
    "bb_web/src/components/task-graph/TaskGraphPreviewPanel.vue"
  ],
  "related_tickets": [],
  "attachments": [],
  "extra": {}
}
