{
  "schema_version": 1,
  "title": "Symphony 可作为 Spec Arena pilot 但需拆出独立范围",
  "time": "2026-05-27T12:40:43Z",
  "source": "codex",
  "project": "blackboard",
  "topic": "spec-arena-symphony-pilot-scope-boundary",
  "done": [
    "评估 `wiki/research/2026-05-26-openai-symphony-codex-orchestration.md`：394 行，结构完整，覆盖 Symphony 定位、架构、调度、工具集成、与 TaskGraph 对比和借鉴意义。",
    "判断该文档适合作为 Spec Arena dogfood/pilot 的真实素材，但它是 research report，不是 draft；必须先派生窄范围 draft，再进入 Draft Admission Human Gate。",
    "在 000091 追加记录：000091 只定义 arena 机制和输出契约；Symphony pilot 必须拆成独立子票/实验，不得把 Symphony 上层 dispatcher、TaskGraph 整合、workspace isolation 等大活混入 091 机制实现。"
  ],
  "validation": [
    "wc -l wiki/research/2026-05-26-openai-symphony-codex-orchestration.md: 394 行",
    "rg headings: 通过，确认文档结构从 TL;DR 到后续建议完整",
    "mcp__bb__.read_ticket_by_id 000091: 通过",
    "mcp__bb__.append_ticket_sections 000091: 通过"
  ],
  "next_step": [
    "如继续推进，创建独立 pilot ticket，限定一个问题，例如“是否引入 Symphony-style tracker dispatcher 到 Blackboard TaskGraph 之上”；明确非目标：不实现完整 Symphony、不改 TaskGraph 执行内核、不接 Linear。"
  ],
  "related_locations": [
    "/Users/ornizhou/development/blackboard/.bb_template/projects/blackboard/wiki/research/2026-05-26-openai-symphony-codex-orchestration.md",
    "/Users/ornizhou/development/blackboard/.bb_template/projects/blackboard/tickets/000091-spec-arena-single-draft-multi-agent-audit.json"
  ],
  "related_tickets": [],
  "attachments": [],
  "extra": {}
}
