{
  "schema_version": 1,
  "title": "Spec Arena v21 schema contracts and handoff",
  "time": "2026-05-30T16:23:53Z",
  "source": "codex",
  "project": "blackboard",
  "topic": "Spec Arena productized graph contracts handoff",
  "done": [
    "把 Spec Arena graph 推到 v21：保留现有 4 reviewer + 4 peer rating + aggregate + attacker + human gate + merge 执行形态，不增加重跑，不把流程改成 hack。",
    "新增 schema registry 形态：resource-bundle-v1、review-output-v1、peer-rating-output-v1、peer-rating-aggregate-v1；graph metadata.schema_registry 现在列出 6 个 schema handle，metadata.product_shape 按 Inputs/Facts、4 Reviews、4 Peer Ratings、Aggregate、Attack/Gate、Merge/Write 六个 lane 描述产品形态。",
    "把 10 个 JSON LLM 节点的 output_contract 挂上 schema_ref/schema_name，并保留 delivery=file，让 MiniMax 直接写 run-scoped JSON artifact，而不是输出 JSON prompt/chat 文本。",
    "修了一个真实 contract bug：schema_validate 的轻量 JSON Schema validator 之前不解析本地 $ref，导致 code-facts-v1 这类带 $defs/$ref 的 schema 约束不完整；现在支持本地 JSON Pointer $ref，并有单测覆盖 unresolved ref。",
    "上一轮实际 run 已证明 MiniMax 会调用 write 写入 review/peer/aggregate/attacker JSON artifact，runtime 读取文件；attacker schema validate 通过，但 human gate 因 attacker 判定 needs_rework 已 hold/cancel，未产出最终 spec。"
  ],
  "validation": [
    "python3 -m json.tool .bb_template/projects/blackboard/task_graphs/spec-arena-4-plus-1.json：通过。",
    "python3 -m json.tool .bb_template/schemas/spec-arena/*.schema.json：通过。",
    "cargo fmt --manifest-path bb_backend/Cargo.toml --all：通过。",
    "cargo test --manifest-path bb_backend/Cargo.toml -p bb_core task_graph::nodes::schema_validate::tests -- --nocapture：13 passed。",
    "cargo fmt --all 在仓库根失败：根目录没有 Cargo.toml；已改用 bb_backend/Cargo.toml 运行成功。",
    "尝试用 Python jsonschema 校验真实 MiniMax artifacts：本机没有 jsonschema 模块，未执行；不要把这项算通过。"
  ],
  "next_step": [
    "其他 agent 接手时优先不要重构源码；继续优化 graph/schema 产品形态即可。建议下一步把 review/peer/aggregate schema_validate 作为显式 contract gate 设计进图，但要控制节点数量和可读性。",
    "如果要重跑 Arena，先确认 088 draft 已包含 attacker P0/P1 修订；此前 attacker 的核心 blocker 包括 BuildCard 类型不一致、client.build().unwrap、FeishuConfig 路径、CLI test-push 优先级。",
    "schema contract 要记牢：graph 表示执行顺序，schema_ref 表示输入输出契约，repair 只能做语法/结构兜底，不能凭空合成 domain claim。",
    "工作区有大量并发/既有 dirty changes，尤其 inbox/tickets/bb_web；接手 agent 不要清理或 revert 非当前范围文件。"
  ],
  "related_locations": [
    "/Users/ornizhou/development/blackboard/.bb_template/projects/blackboard/task_graphs/spec-arena-4-plus-1.json",
    "/Users/ornizhou/development/blackboard/.bb_template/schemas/spec-arena/resource-bundle-v1.schema.json",
    "/Users/ornizhou/development/blackboard/.bb_template/schemas/spec-arena/review-output-v1.schema.json",
    "/Users/ornizhou/development/blackboard/.bb_template/schemas/spec-arena/peer-rating-output-v1.schema.json",
    "/Users/ornizhou/development/blackboard/.bb_template/schemas/spec-arena/peer-rating-aggregate-v1.schema.json",
    "/Users/ornizhou/development/blackboard/.bb_template/schemas/spec-arena/attacker-output-v1.schema.json",
    "/Users/ornizhou/development/blackboard/.bb_template/schemas/spec-arena/code-facts-v1.schema.json",
    "/Users/ornizhou/development/blackboard/bb_backend/crates/bb_core/src/task_graph/nodes/schema_validate.rs",
    "/Users/ornizhou/development/blackboard/bb_backend/crates/bb_core/src/task_graph/nodes/runtime/llm_node.rs",
    "/Users/ornizhou/development/blackboard/.bb_template/projects/blackboard/wiki/research/088-feishu-push-implementation-draft.md"
  ],
  "related_tickets": [
    "000088",
    "000091",
    "000093"
  ],
  "attachments": [
    {
      "kind": "task_graph",
      "target": "project/spec-arena-4-plus-1",
      "label": "Spec Arena 4+1 v21",
      "description": "Graph now carries schema registry/product-shape metadata and LLM output_contract schema refs."
    },
    {
      "kind": "schema",
      "target": "bb://schema/spec-arena/review-output-v1",
      "label": "Reviewer output schema"
    },
    {
      "kind": "schema",
      "target": "bb://schema/spec-arena/peer-rating-output-v1",
      "label": "Peer rating output schema"
    },
    {
      "kind": "schema",
      "target": "bb://schema/spec-arena/peer-rating-aggregate-v1",
      "label": "Peer aggregate schema"
    }
  ],
  "extra": {
    "bb_tools": "tool_search found mcp__bb__; mcp__bb__.create_inbox_note succeeded after starting local dev server",
    "graph_version": "21",
    "handoff_reason": "User reported Codex quota is low and asked to hand off remaining work to other agents",
    "last_live_run": "run-20260528-104108-d097f166 paused at accept-attack-gate then cancelled with hold-for-revision"
  }
}
