{
  "schema_version": 1,
  "title": "Spec Arena v9 schema_ref + strict attacker repair guard",
  "time": "2026-05-28T06:33:34Z",
  "source": "codex",
  "project": "blackboard",
  "topic": "Spec Arena schema registry handle and strict repair guard",
  "done": [
    "`schema_validate` 新增 `schema_ref`：支持 `bb://schema/...` / `schemas/...` 相对 handle，从 workspace `.bb_template/schemas` 加载 JSON schema，同时继续兼容内联 `schema`。",
    "新增 registry schema `schemas/spec-arena/attacker-output-v1.schema.json`，并把 `project/spec-arena-4-plus-1` 从 v8 patch 到 v9：`validate-attacker-schema` 不再内联大 schema，只引用 `bb://schema/spec-arena/attacker-output-v1`。",
    "重启 daemon 后跑通 v9 run `run-20260527-165448-7cbcd56c`：19/19 nodes succeeded，Human Gate 使用 `accept-and-merge`，写出 `implementation_spec.md` 与 `arena_report.md`。",
    "发现并收紧一个假绿风险：v9 run 暴露 attacker 原始输出为 lifecycle-only `turn_start`；已修改 `attacker_output_v1` native repair，只修有语义的扁平 attacker 输出，拒绝从空/生命周期事件凭空合成 attack_items。",
    "更新 000093 附件和 extra：记录 graph v9、schema handle、v9 run、strict repair caveat、final spec/report。"
  ],
  "validation": [
    "`cargo fmt`：通过。",
    "`cargo test schema_validate`：通过，11 passed；新增 schema_ref 解析测试和 lifecycle-only attacker 输出拒绝测试。",
    "TaskGraph API PATCH `project/spec-arena-4-plus-1`：validation passed，version=9。",
    "TaskGraph run `run-20260527-165448-7cbcd56c`：status=succeeded，19/19 nodes succeeded；`validate-attacker-schema` 输出包含 `schema_ref=bb://schema/spec-arena/attacker-output-v1` 且 valid=true。",
    "产物写入验证：`implementation_spec.md` 476 lines / 20332 bytes；`arena_report.md` 182 lines / 9934 bytes。",
    "`python3 -m json.tool` graph/schema：通过。",
    "`python3 scripts/check_ticket_ids.py --project blackboard`：通过。",
    "health checks：bb_daemon 3001 ok、bb_server 3002 ok、frontend 8060 ok。",
    "mcp__bb__.update_ticket 000093：通过；mcp__bb__.complete_handoff 000093：本条。"
  ],
  "next_step": [
    "不要把 v9 run 的 attacker 结果当成高质量 attack 内容；它证明 schema_ref 通路和最终 merge 可跑，但也暴露 Pi/AgentSession 对部分节点可能只落 lifecycle event。",
    "下一步产品化应修 `pi`/AgentSession 输出捕获或给 LLM node 增加 output semantic guard：当 JSON 节点只有 `turn_start` / `auto_retry_start` 等 runtime event 时，节点应失败或重试，而不是交给下游 schema repair。",
    "重新跑收紧后的 v9；如果 attacker 仍输出 lifecycle-only，期望在 `validate-attacker-schema` 失败，这是正确的 fail-closed 行为。"
  ],
  "related_locations": [
    "bb_backend/crates/bb_core/src/task_graph/nodes/schema_validate.rs",
    ".bb_template/schemas/spec-arena/attacker-output-v1.schema.json",
    ".bb_template/projects/blackboard/task_graphs/spec-arena-4-plus-1.json",
    ".bb_template/projects/blackboard/wiki/specs/088-feishu-push/implementation_spec.md",
    ".bb_template/projects/blackboard/wiki/specs/088-feishu-push/arena_report.md",
    "run-20260527-165448-7cbcd56c"
  ],
  "related_tickets": [
    "000093"
  ],
  "attachments": [],
  "extra": {}
}
