{
  "schema_version": 1,
  "title": "手动重跑 nightly 03:00 管线结果",
  "time": "2026-05-24T07:58:15Z",
  "source": "codex",
  "project": "blackboard",
  "topic": "nightly-manual-rerun-diagnosis",
  "done": [
    "确认 2026-05-24 03:00 schedule 已触发但原始 run run-20260523-191600-cc103ac8 失败，失败点在 code-review 子图 collect-review-context shell 节点超时。",
    "通过 REST run-now 触发手动重跑 run-20260524-074420-9ee425c3，并持续轮询到 succeeded。",
    "手动重跑未复现 collect-review-context 挂死：该节点本次约 33 秒完成。",
    "code-quality-check-fix 子图成功，自动修复 bb_daemon/src/codex_client.rs clippy single_match，并在 bb_web/src/styles.css 增加 light mode connector 状态变量。",
    "最终报告已写入 nightly wiki。"
  ],
  "validation": [
    "REST GET /api/projects/blackboard/task-graph-runs/run-20260524-074420-9ee425c3: status=succeeded。",
    "code-review、review-scout-fix、code-quality-check-fix、inbox-ticket-maintain、collect-daily-context、daily-brief、collect-final-facts、nightly-overall-report、system-write-summary 全部 succeeded。",
    "frontend-compile-verify: npm run build --prefix C:\\Dev\\blackboard\\bb_web passed。",
    "rust-compile-verify: cargo clippy --all-targets passed。",
    "ticket audit: 80 JSON tickets, 0 invalid JSON, check_ticket_ids/rebuild_ticket_index/schema check passed。",
    "mcp__bb__.list_projects: 通过；mcp__bb__.create_inbox_note: 本 note 写入。"
  ],
  "next_step": [
    "复盘原始失败 run 的 shell 超时/进程树清理路径；本次未复现，像一次 hang 或 timeout cleanup 问题。",
    "人工确认当前工作区 staged/unstaged/untracked 变更范围，尤其自动生成的 inbox note、nightly report、nul/.codex 残留。",
    "后续单独处理 BbDialog.vue closeLabel i18n 硬编码，以及若干暗色模式硬编码颜色。"
  ],
  "related_locations": [
    ".bb_template/runtime/task_graph_schedules/blackboard/nightly-auto-code-optimization-0300.json",
    ".bb_template/projects/blackboard/wiki/nightly/nightly-report-2026-05-24.md",
    "bb_backend/crates/bb_daemon/src/codex_client.rs",
    "bb_web/src/styles.css"
  ],
  "related_tickets": [
    "000081"
  ],
  "attachments": [
    {
      "kind": "wiki",
      "target": "nightly/nightly-report-2026-05-24.md",
      "label": "Nightly report 2026-05-24",
      "description": "手动重跑 run-20260524-074420-9ee425c3 生成的最终报告"
    }
  ],
  "extra": {
    "diagnosis": "凌晨失败点是 collect-review-context shell 节点超时；手动重跑成功，未复现。",
    "failed_child_run_id": "run-20260523-191604-c90045a5",
    "failed_schedule_run_id": "run-20260523-191600-cc103ac8",
    "manual_maintenance_run_id": "run-20260524-075454-f7b8de22",
    "manual_quality_run_id": "run-20260524-074657-344c2c41",
    "manual_run_id": "run-20260524-074420-9ee425c3"
  }
}
