{
  "schema_version": 1,
  "title": "000085 Desktop init / dev / packaging 自测完成",
  "time": "2026-05-25T13:15:53Z",
  "source": "codex",
  "project": "blackboard",
  "topic": "Desktop 与开发目录 Blackboard 数据边界实施完成",
  "done": [
    "Workspace::list_projects 对 stale location 和无效 project meta 做容错，单个坏 registry entry 不再导致 /api/projects 500。",
    "Desktop 启动会从 bundled seed materialize 内置 blackboard 到 ~/.bb/projects/blackboard，并保证 registry 中 blackboard -> ./blackboard。",
    "desktop.py 打包阶段生成 clean seed/home-template：seed registry 只保留 blackboard 相对路径，home-template 为空 workspace。",
    "dev.py --user-root/--root 初始化用户态 .bb 时也 materialize blackboard 并注册相对路径。"
  ],
  "validation": [
    "cargo test --manifest-path bb_backend/Cargo.toml -p bb_core workspace::tests -- --nocapture：通过，3 tests。",
    "cargo check --manifest-path bb_desktop/src-tauri/Cargo.toml：通过。",
    "python -m py_compile scripts/dev.py scripts/desktop.py：通过。",
    "python scripts/desktop.py prepare --release --skip-web-build --skip-sidecar-build：通过，seed/home-template 校验通过。",
    "npm run build in bb_desktop with CARGO_BUILD_JOBS=1：通过，生成 blackboard-desktop.exe 与 NSIS installer。",
    "真实启动 release desktop：/api/projects 返回 200，data_root 为 C:\\\\Users\\\\ornizhou\\\\.bb\\\\projects\\\\blackboard。",
    "dev daemon --root .bb_template on 3071：/api/projects 返回 200。",
    "dev.py --backend --root runtime/tmp/dev-root-000085/.bb with ports 3072/3073：daemon/server /api/projects 均返回 200。"
  ],
  "next_step": [],
  "related_locations": [
    "bb_backend/crates/bb_core/src/workspace.rs",
    "bb_desktop/src-tauri/src/lib.rs",
    "scripts/desktop.py",
    "scripts/dev.py",
    "bb_desktop/src-tauri/target/release/blackboard-desktop.exe",
    "bb_desktop/src-tauri/target/release/bundle/nsis/Blackboard_0.1.0_x64-setup.exe"
  ],
  "related_tickets": [
    "000085"
  ],
  "attachments": [],
  "extra": {}
}
