{
  "schema_version": 1,
  "title": "Spec Arena v8 native schema repair verified",
  "time": "2026-05-27T16:44:18Z",
  "source": "codex",
  "project": "blackboard",
  "topic": "Spec Arena v8 native repair live success",
  "done": [
    "重启 Blackboard dev stack，使 bb_daemon 重新加载本轮 bb_core schema_validate native repair 代码；3001/3002/8060 均恢复。",
    "启动 `project/spec-arena-4-plus-1` v8 run `run-20260527-162617-47f6b3ed`，完整通过 4 reviewer、4 peer rating、aggregate、attacker、native schema validate、human gate、merge、report、write。",
    "`validate-attacker-schema` 对扁平 attacker 输出执行 `attacker_output_v1` deterministic repair，生成完整 `attack_items`，`valid=true`，repair_notes 记录 wrapped/normalized flat attacker output。",
    "Human Gate 使用 `accept-and-merge` 恢复，最终写出 v8 implementation spec 和 arena report。",
    "更新 000093 extra/attachments：task_graph_version=8，successful_run_id=run-20260527-162617-47f6b3ed，native_repair_validated=true。"
  ],
  "validation": [
    "TaskGraph run `run-20260527-162617-47f6b3ed`: status=succeeded，19/19 nodes succeeded。",
    "`write-final-spec`: ok，33337 bytes；`implementation_spec.md` 781 lines。",
    "`write-arena-report`: ok，9622 bytes；`arena_report.md` 205 lines。",
    "`cargo test schema_validate`: 7 passed。",
    "`python3 scripts/check_ticket_ids.py --project blackboard`: passed。",
    "`qmd embed`: passed / all content hashes already have embeddings。",
    "`curl` health checks: bb_daemon 3001 ok、bb_server 3002 ok、frontend 8060 ok。"
  ],
  "next_step": [
    "让人审阅 v8 `wiki/specs/088-feishu-push/implementation_spec.md`；若接受，可将 088 从 spec 阶段推进到实现阶段。",
    "后续产品化可以把 attacker_output_v1 这种 repair 从 hard-coded kind 继续抽成 schema registry / graph compiler 生成的 repair contract。"
  ],
  "related_locations": [
    "bb_backend/crates/bb_core/src/task_graph/nodes/schema_validate.rs",
    ".bb_template/projects/blackboard/task_graphs/spec-arena-4-plus-1.json",
    ".bb_template/projects/blackboard/wiki/specs/088-feishu-push/implementation_spec.md",
    ".bb_template/projects/blackboard/wiki/specs/088-feishu-push/arena_report.md",
    "AGENTS.md"
  ],
  "related_tickets": [
    "000093"
  ],
  "attachments": [],
  "extra": {}
}
