{
  "schema_version": 1,
  "title": "LLM 节点按需注入 Browser Use toolkit 实验版",
  "time": "2026-05-24T08:20:37Z",
  "source": "codex",
  "project": "blackboard",
  "topic": "taskgraph-llm-toolkits-browser-use-experiment",
  "done": [
    "为 LLM config 增加 `toolkits` 字段，支持别名 `capabilities` / `tool_capabilities`，当前实现 `browser_use`。",
    "新增统一的 ToolInjectionPlan：先解析节点级 toolkit，再按 runtime 展开为 skills / MCP servers / prompt prelude；Codex browser_use 从用户 Codex config 读取 `mcp_servers.node_repl`，再通过 `--config mcp_servers.node_repl=...` 注入到子 Codex。",
    "`browser_use` 会注入 Codex Browser 插件的 `browser-client.mjs` bootstrap 指令；如果 runtime 不是 codex，会在 validation/resolve 阶段阻断而不是静默降级。",
    "Agent mode 现在也会合并节点级 `skills`、`mcp_servers` 与 toolkit 注入，不再只吃 profile 里的工具配置。",
    "前端 LLM 节点表单增加 Toolkits 区域，可勾选 Browser Use；节点 meta 会显示已启用 toolkits。"
  ],
  "validation": [
    "cargo fmt --all: 通过。",
    "cargo test -p bb_core task_graph::nodes::llm::tests: 通过，17/17。",
    "cargo check -p bb_core: 通过。",
    "npm run build --prefix bb_web: 通过。",
    "git diff --check（本次修改文件范围）: 通过，仅 CRLF warning。",
    "Browser 插件打开 system/frontend-ui-convergence-codex/edit：页面加载、无 console error；未进一步保存 graph。"
  ],
  "next_step": [
    "如果要让某个 Codex LLM 节点真实拉 Browser Use，在该节点 config 加 `toolkits: [\"browser_use\"]` 或在 UI 勾选 Browser Use 后保存并重跑。",
    "Pi 的 MCP 注入仍然走 provider-specific `.pi/mcp.json` 渲染路径；如要做到 Pi 每节点完全隔离，需要 Pi runtime 支持显式 config path 或我们进一步设计 per-session Pi execution root。"
  ],
  "related_locations": [
    "bb_backend/crates/bb_core/src/task_graph/definition/types.rs",
    "bb_backend/crates/bb_core/src/task_graph/nodes/llm.rs",
    "bb_backend/crates/bb_core/src/task_graph/validation/config.rs",
    "bb_web/src/components/task-graph/TaskGraphLlmNodeForm.vue",
    "bb_web/src/components/task-graph/taskGraphNodeVisuals.ts",
    "bb_web/src/components/TaskGraphEditorPanel.vue",
    "bb_web/src/i18n.ts"
  ],
  "related_tickets": [],
  "attachments": [],
  "extra": {}
}
