{
  "schema_version": 1,
  "title": "代码监控检查和修复 graph handoff",
  "time": "2026-05-23T17:00:42Z",
  "source": "task-graph-code-monitor-check-fix",
  "project": "blackboard",
  "topic": "code-monitor-check-fix-pi-mcp-handoff",
  "done": [
    "i18n 检查完成：扫描 bb_web/src/ 下所有 Vue 文件，未发现硬编码用户可见文本，现有 600+ 翻译 key 覆盖完善",
    "明暗模式检查完成：styles.css 暗色模式覆盖全面，Vue 组件中存在 7 处硬编码颜色值属优化建议",
    "前端编译验证通过：npm run build 退出码 0，14.09s 完成无错误",
    "Clippy 自动修复完成：扫描 5 个 crate，自动修复 9 处 lint 问题（case_sensitive、ref_option、unreadable_literal、needless_continue、map_unwrap_or、redundant_closure、default_trait_access）",
    "Rust 编译验证通过：cargo check 退出码 0，代码可正常编译"
  ],
  "validation": [
    "前端构建：npm run build 成功（退出码 0），产物约 60 个 chunk gzip 后 1.4MB",
    "前端 i18n：600+ 翻译 key 覆盖 Tickets/Agents/Task Graphs/Wiki/Settings 等模块",
    "后端 clippy：扫描 --all-targets 退出码 0，剩余 1 个建议性警告（codex_client.rs:354 match 改 if let）",
    "后端编译：cargo check 成功，无阻塞错误",
    "后端格式化：cargo fmt 退出码 0，代码风格符合 Rust 规范"
  ],
  "next_step": [
    "前端优化：7 个 Vue 组件的硬编码颜色改为 CSS 变量以提升暗色模式体验（优先级低）",
    "后端优化：codex_client.rs:354 单分支 match 建议改用 if let（可选，低优先级）"
  ],
  "related_locations": [
    ".bb_template/task_graphs/system/code-monitor-check-fix.json",
    "scripts/task_graph_code_monitor_verify.py"
  ],
  "related_tickets": [],
  "attachments": [],
  "extra": {}
}
