{
  "schema_version": 1,
  "title": "TaskGraphPreviewPanel 节点弹层关闭按钮迁到 BbIconCommand",
  "time": "2026-05-25T02:12:07Z",
  "source": "Codex",
  "project": "blackboard",
  "topic": "bb_web UI primitive 收敛：TaskGraphPreviewPanel 节点弹层关闭动作",
  "done": [
    "将 TaskGraphPreviewPanel 节点 popover 的本地关闭 button 替换为 BbIconCommand。",
    "删除该 popover header button 的局部皮肤/hover CSS，保留页面局部布局与 BbInfoGrid 密度变量。",
    "未修改 shared primitive；因此未改 DESIGN.md。"
  ],
  "validation": [
    "npm run build --prefix C:/Dev/blackboard/bb_web：通过。"
  ],
  "next_step": [
    "可继续扫描 Task Graph 局部 raw button 或局部 field row，按同样小范围迁到 common primitives。"
  ],
  "related_locations": [],
  "related_tickets": [],
  "attachments": [],
  "extra": {
    "locations": "bb_web/src/components/task-graph/TaskGraphPreviewPanel.vue",
    "tools": "mcp__bb__.list_projects: 通过；mcp__bb__.create_inbox_note: 通过；npm run build --prefix C:/Dev/blackboard/bb_web: 通过"
  }
}
