{
  "schema_version": 1,
  "title": "继续收敛字段与 checkbox：NodeInspector / LLM / Editor settings",
  "time": "2026-05-23T15:44:40Z",
  "source": "codex",
  "project": "blackboard",
  "topic": "frontend-shared-ui-primitives-seventh-pass",
  "done": [
    "新增 `BbCheckboxField` 公共组件，并在 `src/styles.css` 下补统一 checkbox field 样式。",
    "将 `TaskGraphNodeInspector` 的普通字段从裸 `label/input/select/textarea` 迁到 `BbField`，将 schema/system_write/shell 等 checkbox 迁到 `BbCheckboxField`，删除 NodeInspector 本地 broad field/checkbox selector。",
    "将 `TaskGraphLlmNodeForm` 的 resource bundle required checkbox 迁到 `BbCheckboxField`，删除已无用的 `checkedValue` helper。",
    "将 `TaskGraphEditorPanel` 的 graph settings 字段迁到 `BbField`，run policy checkbox 迁到 `BbCheckboxField`，并清理 EditorPanel 中旧 NodeInspector / rule row 死 CSS。",
    "更新 `DESIGN.md`，明确 routine boolean settings 使用 `BbCheckboxField`，不再新增局部 `*-checkbox-row`。"
  ],
  "validation": [
    "`npm run build --prefix bb_web`: 通过。",
    "`git diff --check` 针对本轮相关文件：通过，仅 CRLF 提示。",
    "`rg` 检查 `checkbox-row`、裸 `type=\"checkbox\"`、settings/node-card broad field selector、`checkboxValue`：目标文件内未命中。",
    "Browser in-app smoke：当前 task graph URL 可加载且 console error 为 0；该 route 当前渲染 catalog shell，未展示 settings/inspector，因此真实视觉验收仍需稳定打开 editor inspector 的 route/fixture。"
  ],
  "next_step": [
    "继续收敛 `TaskGraphSchedulePanel` 的 schedule row/detail metric cells，考虑抽 `BbMetricCell` 或轻量 definition-grid。",
    "继续找剩余高频局部 broad selectors，优先处理 Agents/Settings 页面中重复 table/action row 样式。"
  ],
  "related_locations": [
    "bb_web/src/components/common/BbCheckboxField.vue",
    "bb_web/src/components/common/index.ts",
    "bb_web/src/styles.css",
    "bb_web/src/components/TaskGraphEditorPanel.vue",
    "bb_web/src/components/task-graph/TaskGraphLlmNodeForm.vue",
    "bb_web/src/components/task-graph/TaskGraphNodeInspector.vue",
    "bb_web/DESIGN.md"
  ],
  "related_tickets": [],
  "attachments": [],
  "extra": {}
}
