{
  "schema_version": 1,
  "title": "Frontend UI convergence pass and Codex graph handoff",
  "time": "2026-05-24T00:00:00+08:00",
  "source": "codex",
  "project": "blackboard",
  "topic": "frontend-ui-convergence-codex-graph",
  "done": [
    "新增 shared primitives `BbActionGroup` 与 `BbIconCommand`，并让 `BbButton iconOnly` 自动回退使用 title 作为 aria-label。",
    "将 IdeaCanvas 的刷新/新建/删除确认动作迁到 `BbActionGroup` + `BbButton`/`BbIconCommand`，移除旧 `bb-primary-command`/`bb-secondary-command` 业务用法。",
    "将 RuntimeConnectorPanel 的页头动作与 Pi Git Bash workaround 动作迁到 shared button/action group，删除本地 `runtime-button` 皮肤 CSS。",
    "新增系统 graph `frontend-ui-convergence-codex`，流程为 scan -> Codex patch(gpt-5.5 medium) -> static validate loop -> runtime 内部报告。",
    "新增确定性脚本 `scripts/task_graph_frontend_ui_convergence.py`，支持 scan/validate，validate 会跑遗留 selector 扫描、`git diff --check` 与 `npm run build --prefix bb_web`。"
  ],
  "validation": [
    "`python -m py_compile scripts/task_graph_frontend_ui_convergence.py`: 通过。",
    "`python scripts/task_graph_frontend_ui_convergence.py validate --repo-root . --frontend-workspace bb_web --timeout-seconds 900`: 通过，has_issues=false，selector matches=0，git diff --check=0，npm build=0。",
    "`python -m json.tool .bb_template/task_graphs/system/frontend-ui-convergence-codex.json`: 通过。",
    "HTTP GET `/api/projects/blackboard/task-graphs/system/frontend-ui-convergence-codex`: 通过，返回 graph id/frontend-ui-convergence-codex，7 nodes，6 edges。",
    "in-app Browser smoke：`/idea-canvas` 渲染到 1 个 action group、2 个 BbButton、1 个 BbIconCommand，无 console error；`/settings` RuntimeConnectorPanel 渲染，无 console error，但当前后端返回 `/api/agents/runtime-connectors` 404。"
  ],
  "next_step": [
    "如果要让 graph 真正接管后续机械收敛，下一轮可以直接运行 `frontend-ui-convergence-codex`，观察 Codex 在 tool_policy/write_roots 下的修改质量。",
    "Settings 的 `/api/agents/runtime-connectors` 404 不是本轮前端构建错误；如果需要恢复 RuntimeConnector 数据，需要单独看当前后端路由/进程版本。"
  ],
  "related_locations": [
    "bb_web/src/components/common/BbActionGroup.vue",
    "bb_web/src/components/common/BbIconCommand.vue",
    "bb_web/src/components/common/BbButton.vue",
    "bb_web/src/components/IdeaCanvasPanel.vue",
    "bb_web/src/components/RuntimeConnectorPanel.vue",
    "bb_web/src/styles.css",
    "bb_web/DESIGN.md",
    "scripts/task_graph_frontend_ui_convergence.py",
    ".bb_template/task_graphs/system/frontend-ui-convergence-codex.json"
  ],
  "related_tickets": [],
  "attachments": [],
  "extra": {}
}
