{
  "schema_version": 1,
  "title": "代码监控检查和修复 graph handoff",
  "time": "2026-05-26T03:21:02Z",
  "source": "task-graph-code-monitor-check-fix",
  "project": "blackboard",
  "topic": "code-monitor-check-fix-pi-mcp-handoff",
  "done": [
    "前端 i18n 完整性检查通过，68个文件扫描无硬编码用户文本，模板插值/属性绑定均已国际化",
    "前端暗色模式样式修复完成，styles.css 添加 .bb-dashboard-sidebar 暗色背景适配",
    "前端编译验证通过，npm run build 退出码0，耗时23.41s，无错误警告，构建产物约4.3MB",
    "后端 Rust 5个 crate (bb_core/server/daemon/schema/cli) clippy 检查通过，0警告0错误",
    "后端代码格式化验证通过，cargo fmt 无格式变更，编译验证0警告"
  ],
  "validation": [
    "前端构建验证: npm run build 退出码0，耗时23.41s，无错误无警告",
    "后端 clippy 严格模式验证: cargo clippy -D warnings 通过，0问题0警告",
    "后端格式化验证: cargo fmt 退出码0，无格式变更",
    "后端编译验证: cargo clippy --all-targets 通过，Finished dev profile"
  ],
  "next_step": [
    "AgentConnectorRow.vue/TicketDependencyGraph.vue 等7个文件存在状态颜色硬编码，建议建立CSS变量系统统一主题化 (优先级: 中)"
  ],
  "related_locations": [
    ".bb_template/task_graphs/system/code-monitor-check-fix.json",
    "scripts/task_graph_code_monitor_verify.py"
  ],
  "related_tickets": [],
  "attachments": [],
  "extra": {}
}
